[{"coverageId":"coverage_00000000000000000000000000000003","scope":"opaque shell request and observed file effects","modes":["intercepted","verified","unknown"],"evidenceEventIds":["evt_00000000000000000000000000000061","evt_00000000000000000000000000000062","evt_00000000000000000000000000000063"],"gaps":[{"kind":"opaque","scope":"prospective shell effects before execution","reason":"the gateway cannot enumerate arbitrary shell effects before execution","evidenceEventIds":["evt_00000000000000000000000000000061"]},{"kind":"missing_sequence","scope":"source:gateway:source_gateway:aaaaaaaa-aaaa-4aaa-8aaa-aaaaaaaaaaa1:sequence:1","reason":"the gateway producer sequence skipped from zero to two","evidenceEventIds":["evt_00000000000000000000000000000061","evt_00000000000000000000000000000063"]}],"presentation":"degraded"}]
